{
  "$schema": "https://json-schema.org/draft/2020-12/schema",
  "title": "Falnama Scenario Index Card",
  "description": "An immutable, timestamped, content-hashed mapping from a prediction-market question to its plausible downstream asset implications. Created BEFORE any recommendation and never edited in place, so a later trade can always be traced to a prior, frozen hypothesis. JSON has no comments, so field meanings live in 'description'.",
  "type": "object",
  "additionalProperties": false,
  "required": [
    "card_id",
    "card_version",
    "card_hash",
    "do_not_revise",
    "created_time_utc",
    "mock_mode",
    "source",
    "market_name",
    "prediction_window",
    "predictions",
    "evidence_used",
    "uncertainty_notes",
    "llm_justification"
  ],
  "properties": {
    "card_id": {
      "type": "string",
      "minLength": 1,
      "description": "Stable identifier, derived from the market key plus the creation timestamp."
    },
    "card_version": {
      "type": "string",
      "description": "e.g. 'v1' for a live card or 'v1-mock' for a deterministic mock card."
    },
    "card_hash": {
      "type": "string",
      "pattern": "^[a-f0-9]{64}$",
      "description": "SHA-256 over the card with this field blanked. Detects any later tampering."
    },
    "do_not_revise": {
      "const": true,
      "description": "Always true. Cards are immutable; regeneration writes a NEW card."
    },
    "created_time_utc": {
      "type": "string",
      "format": "date-time",
      "description": "When the card was created. The recommender compares this to an anomaly's trigger time to reject ex-post cards."
    },
    "mock_mode": {
      "type": "boolean",
      "description": "True if produced by the deterministic mock generator rather than the live LLM."
    },
    "source": {
      "type": "object",
      "additionalProperties": false,
      "required": ["market_id", "market_slug", "market_name", "market_url"],
      "description": "Provenance: which market this card is about.",
      "properties": {
        "market_id": {"type": ["string", "null"]},
        "market_slug": {"type": ["string", "null"]},
        "market_name": {"type": "string"},
        "market_url": {"type": ["string", "null"]},
        "source_market_file": {"type": ["string", "null"], "description": "The selected-markets file this market came from."}
      }
    },
    "market_name": {"type": "string", "minLength": 1},
    "prediction_window": {
      "type": "string",
      "minLength": 1,
      "description": "Horizon the card reasons over, e.g. '12h'."
    },
    "predictions": {
      "type": "array",
      "minItems": 1,
      "description": "One or more asset implications of the market event.",
      "items": {
        "type": "object",
        "additionalProperties": false,
        "required": [
          "asset",
          "asset_class",
          "expected_direction",
          "expected_return_12h_bps",
          "confidence",
          "confidence_interval_bps",
          "trade_eligibility",
          "time_plan",
          "reasoning"
        ],
        "properties": {
          "asset": {"type": "string", "minLength": 1, "description": "Plain-language asset, e.g. 'Crude oil'."},
          "ticker": {"type": ["string", "null"], "description": "Optional symbol, e.g. 'USO'."},
          "tradable_instrument_name": {"type": ["string", "null"], "description": "The concrete instrument, e.g. 'United States Oil Fund'."},
          "asset_class": {
            "enum": ["equity", "etf", "equity_index", "fx_proxy", "commodity", "other"]
          },
          "expected_direction": {
            "enum": ["up", "down", "mixed", "unclear"],
            "description": "Direction of the expected move in the asset."
          },
          "expected_return_12h_bps": {
            "type": "number",
            "description": "Expected return over the prediction window, in basis points (100 bps = 1%). Sign matches direction."
          },
          "confidence": {
            "type": "number",
            "minimum": 0,
            "maximum": 1,
            "description": "Subjective probability the mapping is correct, 0..1."
          },
          "confidence_interval_bps": {
            "type": "array",
            "minItems": 2,
            "maxItems": 2,
            "items": {"type": "number"},
            "description": "[low, high] plausible range for the expected return, in bps."
          },
          "trade_eligibility": {
            "type": "object",
            "additionalProperties": false,
            "required": ["eligible", "reason", "minimum_expected_move_bps"],
            "properties": {
              "eligible": {"type": "boolean"},
              "reason": {"type": "string"},
              "minimum_expected_move_bps": {"type": "number"}
            },
            "description": "Whether the expected move clears the configured threshold to be actionable on paper."
          },
          "time_plan": {
            "type": "object",
            "additionalProperties": false,
            "required": ["30m", "1h", "2h", "6h", "12h"],
            "properties": {
              "30m": {"type": "string"},
              "1h": {"type": "string"},
              "2h": {"type": "string"},
              "6h": {"type": "string"},
              "12h": {"type": "string"}
            },
            "description": "What to re-check at each checkpoint after the signal — the monitoring plan."
          },
          "reasoning": {"type": "string", "minLength": 1, "description": "Why this market move implies this asset move."}
        }
      }
    },
    "realized_outcome": {
      "enum": ["Yes", "No", "Unknown", "Other"],
      "description": "Optional: how the market actually resolved, filled in later for evaluation."
    },
    "conclusion_time_utc": {"type": ["string", "null"], "format": "date-time"},
    "evidence_used": {
      "type": "array",
      "minItems": 1,
      "items": {"type": "string"},
      "description": "The inputs the analysis relied on (market metadata, sensitivity mapping, analogues, public info to check)."
    },
    "uncertainty_notes": {
      "type": "array",
      "minItems": 1,
      "items": {"type": "string"},
      "description": "Caveats. Mock cards say so explicitly here."
    },
    "llm_justification": {
      "type": "object",
      "additionalProperties": false,
      "required": ["summary", "key_assumptions", "failure_modes", "why_not_ex_post"],
      "description": "The reasoning record. 'why_not_ex_post' states how immutability + hashing prevent retrofitting a story to a move.",
      "properties": {
        "summary": {"type": "string"},
        "key_assumptions": {"type": "array", "items": {"type": "string"}},
        "failure_modes": {"type": "array", "items": {"type": "string"}},
        "why_not_ex_post": {"type": "string"}
      }
    }
  }
}
