{
  "card_id": "665374_20261010T134810Z",
  "card_version": "v1-mock",
  "card_hash": "d4d98d58c06cac4dbb39bb3b8f891518a28fc19040bc15ba91847c77c4b12ce5",
  "do_not_revise": true,
  "created_time_utc": "2026-10-10T13:48:10Z",
  "mock_mode": true,
  "source": {
    "market_id": "665374",
    "market_slug": "will-the-us-invade-iran-before-2027",
    "market_name": "Will the U.S. invade Iran before 2027?",
    "market_url": "https://polymarket.com/market/will-the-us-invade-iran-before-2027",
    "source_market_file": "screened_markets_latest.csv"
  },
  "market_name": "Will the U.S. invade Iran before 2027?",
  "prediction_window": "12h",
  "predictions": [
    {
      "asset": "Crude oil",
      "ticker": "USO",
      "tradable_instrument_name": "United States Oil Fund",
      "asset_class": "commodity",
      "expected_direction": "down",
      "expected_return_12h_bps": -850.0,
      "confidence": 0.62,
      "confidence_interval_bps": [
        -1400.0,
        -250.0
      ],
      "trade_eligibility": {
        "eligible": true,
        "reason": "Meets minimum expected move.",
        "minimum_expected_move_bps": 700.0
      },
      "time_plan": {
        "30m": "Reassess the thesis at T+30m.",
        "1h": "Reassess the thesis at T+1h.",
        "2h": "Reassess the thesis at T+2h.",
        "6h": "Reassess the thesis at T+6h.",
        "12h": "Reassess the thesis at T+12h."
      },
      "reasoning": "MOCK: maps a geopolitical prediction-market signal to a broad liquid proxy. Replace with live LLM reasoning by setting card_mode: live."
    }
  ],
  "evidence_used": [
    "prediction-market question and metadata",
    "market-to-asset sensitivity mapping",
    "public information to be checked before any action"
  ],
  "uncertainty_notes": [
    "MOCK card \u2014 not an investment recommendation."
  ],
  "llm_justification": {
    "summary": "Mock scenario card generated for pipeline testing.",
    "key_assumptions": [
      "The prediction-market signal contains information not fully in public assets.",
      "The chosen instrument is a liquid enough proxy for the event risk."
    ],
    "failure_modes": [
      "The prediction-market move reverses.",
      "Public information already explained the move.",
      "The proxy asset is weakly exposed to the event."
    ],
    "why_not_ex_post": "The card is timestamped, content-hashed, and never overwritten. Execution must reject any card created after an anomaly's trigger time."
  }
}
